[
  {
    "id": 1001,
    "province_id": 10,
    "en": "Phra Nakhon",
    "th": "พระนคร",
    "subdistricts": [
      100101, 100102, 100103, 100104, 100105, 100106, 100107, 100108, 100109, 100110, 100111, 100112
    ]
  },
  {
    "id": 1002,
    "province_id": 10,
    "en": "Dusit",
    "th": "ดุสิต",
    "subdistricts": [100201, 100202, 100203, 100204, 100206]
  },
  {
    "id": 1003,
    "province_id": 10,
    "en": "Nong Chok",
    "th": "หนองจอก",
    "subdistricts": [100301, 100302, 100303, 100304, 100305, 100306, 100307, 100308]
  },
  {
    "id": 1004,
    "province_id": 10,
    "en": "Bang Rak",
    "th": "บางรัก",
    "subdistricts": [100401, 100402, 100403, 100404, 100405]
  },
  {
    "id": 1005,
    "province_id": 10,
    "en": "Bang Khen",
    "th": "บางเขน",
    "subdistricts": [100502, 100508]
  },
  {
    "id": 1006,
    "province_id": 10,
    "en": "Bang Kapi",
    "th": "บางกะปิ",
    "subdistricts": [100601, 100608]
  },
  {
    "id": 1007,
    "province_id": 10,
    "en": "Pathum Wan",
    "th": "ปทุมวัน",
    "subdistricts": [100701, 100702, 100703, 100704]
  },
  {
    "id": 1008,
    "province_id": 10,
    "en": "Pom Prap Sattruphai",
    "th": "ป้อมปราบศัตรูพ่าย",
    "subdistricts": [100801, 100802, 100803, 100804, 100805]
  },
  {
    "id": 1009,
    "province_id": 10,
    "en": "Phra Khanong",
    "th": "พระโขนง",
    "subdistricts": [100905, 100910]
  },
  {
    "id": 1010,
    "province_id": 10,
    "en": "Min Buri",
    "th": "มีนบุรี",
    "subdistricts": [101001, 101002]
  },
  {
    "id": 1011,
    "province_id": 10,
    "en": "Lat Krabang",
    "th": "ลาดกระบัง",
    "subdistricts": [101101, 101102, 101103, 101104, 101105, 101106]
  },
  {
    "id": 1012,
    "province_id": 10,
    "en": "Yannawa",
    "th": "ยานนาวา",
    "subdistricts": [101203, 101204]
  },
  {
    "id": 1013,
    "province_id": 10,
    "en": "Samphanthawong",
    "th": "สัมพันธวงศ์",
    "subdistricts": [101301, 101302, 101303]
  },
  {
    "id": 1014,
    "province_id": 10,
    "en": "Phaya Thai",
    "th": "พญาไท",
    "subdistricts": [101401, 101406]
  },
  {
    "id": 1015,
    "province_id": 10,
    "en": "Thon Buri",
    "th": "ธนบุรี",
    "subdistricts": [101501, 101502, 101503, 101504, 101505, 101506, 101507]
  },
  {
    "id": 1016,
    "province_id": 10,
    "en": "Bangkok Yai",
    "th": "บางกอกใหญ่",
    "subdistricts": [101601, 101602]
  },
  {
    "id": 1017,
    "province_id": 10,
    "en": "Huai Khwang",
    "th": "ห้วยขวาง",
    "subdistricts": [101701, 101702, 101704]
  },
  {
    "id": 1018,
    "province_id": 10,
    "en": "Khlong San",
    "th": "คลองสาน",
    "subdistricts": [101801, 101802, 101803, 101804]
  },
  {
    "id": 1019,
    "province_id": 10,
    "en": "Taling Chan",
    "th": "ตลิ่งชัน",
    "subdistricts": [101901, 101902, 101903, 101904, 101905, 101907]
  },
  {
    "id": 1020,
    "province_id": 10,
    "en": "Bangkok Noi",
    "th": "บางกอกน้อย",
    "subdistricts": [102004, 102005, 102006, 102007, 102009]
  },
  {
    "id": 1021,
    "province_id": 10,
    "en": "Bang Khun Thian",
    "th": "บางขุนเทียน",
    "subdistricts": [102105, 102107]
  },
  {
    "id": 1022,
    "province_id": 10,
    "en": "Phasi Charoen",
    "th": "ภาษีเจริญ",
    "subdistricts": [102201, 102202, 102206, 102207, 102208, 102209, 102210]
  },
  {
    "id": 1023,
    "province_id": 10,
    "en": "Nong Khaem",
    "th": "หนองแขม",
    "subdistricts": [102302, 102303]
  },
  {
    "id": 1024,
    "province_id": 10,
    "en": "Rat Burana",
    "th": "ราษฎร์บูรณะ",
    "subdistricts": [102401, 102402]
  },
  {
    "id": 1025,
    "province_id": 10,
    "en": "Bang Phlat",
    "th": "บางพลัด",
    "subdistricts": [102501, 102502, 102503, 102504]
  },
  {
    "id": 1026,
    "province_id": 10,
    "en": "Din Daeng",
    "th": "ดินแดง",
    "subdistricts": [102601, 102602]
  },
  {
    "id": 1027,
    "province_id": 10,
    "en": "Bung Kum",
    "th": "บึงกุ่ม",
    "subdistricts": [102701, 102704, 102705]
  },
  {
    "id": 1028,
    "province_id": 10,
    "en": "Sa Thon",
    "th": "สาทร",
    "subdistricts": [102801, 102802, 102803]
  },
  {
    "id": 1029,
    "province_id": 10,
    "en": "Bang Su",
    "th": "บางซื่อ",
    "subdistricts": [102901, 102902]
  },
  {
    "id": 1030,
    "province_id": 10,
    "en": "Chatuchak",
    "th": "จตุจักร",
    "subdistricts": [103001, 103002, 103003, 103004, 103005]
  },
  {
    "id": 1031,
    "province_id": 10,
    "en": "Bang Kho Laem",
    "th": "บางคอแหลม",
    "subdistricts": [103101, 103102, 103103]
  },
  {
    "id": 1032,
    "province_id": 10,
    "en": "Prawet",
    "th": "ประเวศ",
    "subdistricts": [103201, 103202, 103203]
  },
  {
    "id": 1033,
    "province_id": 10,
    "en": "Khlong Toei",
    "th": "คลองเตย",
    "subdistricts": [103301, 103302, 103303]
  },
  {
    "id": 1034,
    "province_id": 10,
    "en": "Suan Luang",
    "th": "สวนหลวง",
    "subdistricts": [103401, 103402, 103403]
  },
  {
    "id": 1035,
    "province_id": 10,
    "en": "Chom Thong",
    "th": "จอมทอง",
    "subdistricts": [103501, 103502, 103503, 103504]
  },
  {
    "id": 1036,
    "province_id": 10,
    "en": "Don Mueang",
    "th": "ดอนเมือง",
    "subdistricts": [103602, 103604, 103605]
  },
  {
    "id": 1037,
    "province_id": 10,
    "en": "Rat Thewi",
    "th": "ราชเทวี",
    "subdistricts": [103701, 103702, 103703, 103704]
  },
  {
    "id": 1038,
    "province_id": 10,
    "en": "Lat Phrao",
    "th": "ลาดพร้าว",
    "subdistricts": [103801, 103802]
  },
  {
    "id": 1039,
    "province_id": 10,
    "en": "Watthana",
    "th": "วัฒนา",
    "subdistricts": [103901, 103902, 103903]
  },
  {
    "id": 1040,
    "province_id": 10,
    "en": "Bang Khae",
    "th": "บางแค",
    "subdistricts": [104001, 104002, 104003, 104004]
  },
  {
    "id": 1041,
    "province_id": 10,
    "en": "Lak Si",
    "th": "หลักสี่",
    "subdistricts": [104101, 104102]
  },
  {
    "id": 1042,
    "province_id": 10,
    "en": "Sai Mai",
    "th": "สายไหม",
    "subdistricts": [104201, 104202, 104203]
  },
  {
    "id": 1043,
    "province_id": 10,
    "en": "Khanna Yao",
    "th": "คันนายาว",
    "subdistricts": [104301, 104302]
  },
  {
    "id": 1044,
    "province_id": 10,
    "en": "Saphan Sung",
    "th": "สะพานสูง",
    "subdistricts": [104401, 104402, 104403]
  },
  {
    "id": 1045,
    "province_id": 10,
    "en": "Wang Thong Lang",
    "th": "วังทองหลาง",
    "subdistricts": [104501, 104502, 104503, 104504]
  },
  {
    "id": 1046,
    "province_id": 10,
    "en": "Khlong Sam Wa",
    "th": "คลองสามวา",
    "subdistricts": [104601, 104602, 104603, 104604, 104605]
  },
  {
    "id": 1047,
    "province_id": 10,
    "en": "Bang Na",
    "th": "บางนา",
    "subdistricts": [104702, 104703]
  },
  {
    "id": 1048,
    "province_id": 10,
    "en": "Thawi Watthana",
    "th": "ทวีวัฒนา",
    "subdistricts": [104801, 104802]
  },
  {
    "id": 1049,
    "province_id": 10,
    "en": "Thung Khu",
    "th": "ทุ่งครุ",
    "subdistricts": [104901, 104902]
  },
  {
    "id": 1050,
    "province_id": 10,
    "en": "Bang Bon",
    "th": "บางบอน",
    "subdistricts": [105002, 105003, 105004, 105005]
  },
  {
    "id": 1101,
    "province_id": 11,
    "en": "Mueang Samut Prakan",
    "th": "เมืองสมุทรปราการ",
    "subdistricts": [
      110101, 110102, 110103, 110104, 110108, 110110, 110111, 110112, 110113, 110114, 110115,
      110116, 110117
    ]
  },
  {
    "id": 1102,
    "province_id": 11,
    "en": "Bang Bo",
    "th": "บางบ่อ",
    "subdistricts": [110201, 110202, 110203, 110204, 110205, 110206, 110207, 110208]
  },
  {
    "id": 1103,
    "province_id": 11,
    "en": "Bang Phli",
    "th": "บางพลี",
    "subdistricts": [110301, 110302, 110303, 110304, 110308, 110309]
  },
  {
    "id": 1104,
    "province_id": 11,
    "en": "Phra Pradaeng",
    "th": "พระประแดง",
    "subdistricts": [
      110401, 110402, 110403, 110404, 110405, 110406, 110407, 110408, 110409, 110410, 110411,
      110412, 110413, 110414, 110415
    ]
  },
  {
    "id": 1105,
    "province_id": 11,
    "en": "Phra Samut Chedi",
    "th": "พระสมุทรเจดีย์",
    "subdistricts": [110501, 110502, 110503, 110504, 110505]
  },
  {
    "id": 1106,
    "province_id": 11,
    "en": "Bang Sao Thong",
    "th": "บางเสาธง",
    "subdistricts": [110601, 110602, 110603]
  },
  {
    "id": 1201,
    "province_id": 12,
    "en": "Mueang Nonthaburi",
    "th": "เมืองนนทบุรี",
    "subdistricts": [120101, 120102, 120103, 120104, 120105, 120106, 120107, 120108, 120109, 120110]
  },
  {
    "id": 1202,
    "province_id": 12,
    "en": "Bang Kruai",
    "th": "บางกรวย",
    "subdistricts": [120201, 120202, 120203, 120204, 120205, 120206, 120207, 120208, 120209]
  },
  {
    "id": 1203,
    "province_id": 12,
    "en": "Bang Yai",
    "th": "บางใหญ่",
    "subdistricts": [120301, 120302, 120303, 120304, 120305, 120306]
  },
  {
    "id": 1204,
    "province_id": 12,
    "en": "Bang Bua Thong",
    "th": "บางบัวทอง",
    "subdistricts": [120401, 120402, 120403, 120404, 120405, 120406, 120407, 120408]
  },
  {
    "id": 1205,
    "province_id": 12,
    "en": "Sai Noi",
    "th": "ไทรน้อย",
    "subdistricts": [120501, 120502, 120503, 120504, 120505, 120506, 120507]
  },
  {
    "id": 1206,
    "province_id": 12,
    "en": "Pak Kret",
    "th": "ปากเกร็ด",
    "subdistricts": [
      120601, 120602, 120603, 120604, 120605, 120606, 120607, 120608, 120609, 120610, 120611, 120612
    ]
  },
  {
    "id": 1301,
    "province_id": 13,
    "en": "Mueang Pathum Thani",
    "th": "เมืองปทุมธานี",
    "subdistricts": [
      130101, 130102, 130103, 130104, 130105, 130106, 130107, 130108, 130109, 130110, 130111,
      130112, 130113, 130114
    ]
  },
  {
    "id": 1302,
    "province_id": 13,
    "en": "Khlong Luang",
    "th": "คลองหลวง",
    "subdistricts": [130201, 130202, 130203, 130204, 130205, 130206, 130207]
  },
  {
    "id": 1303,
    "province_id": 13,
    "en": "Thanyaburi",
    "th": "ธัญบุรี",